{
  "lock_version": 1,
  "created_at": "2026-10-18T01:45:00Z",
  "created_by": "example file, not fitted on real data",
  "holdout_rate": 0.1,
  "decisions": {
    "fresh_start": {
      "engine": { "kind": "openrouter", "model": "microsoft/microsoft-decision-1" },
      "question_hash": "sha256:ea489a18f63e8517aa0fba6d453a2e863185669a8630684fdd20608a68c86bc4",
      "labels": ["continue", "compact", "clear"],
      "calibration": { "method": "isotonic" },
      "thresholds": {
        "clear": { "act": 0.85, "unsure": 0.6 },
        "compact": { "act": 0.9, "unsure": 0.65 }
      },
      "target_false_alarm": 0.05,
      "fitted_on": { "n": 300, "false_alarm_upper": 0.05, "coverage": 0.4, "confidence": 0.95 }
    },
    "stuck": {
      "engine": { "kind": "rules" },
      "question_hash": "sha256:bbd7fd603437d4b7a33e1656c9100a6611ec55ca072ef3ccce9521d5028f84a8",
      "labels": ["progressing", "stuck"],
      "calibration": { "method": "none" },
      "thresholds": { "stuck": { "act": 0.9, "unsure": 0.7 } },
      "target_false_alarm": 0.05
    }
  }
}
